name,city,cityfilter,thumb,link,facebook,twitter,description
National Theatre,London,London,NationalTheatre.jpg,1,1,1,"At the National Theatre, we make world-class theatre that is entertaining, challenging and inspiring, and we make it for everyone. In 2016-2017, the NT staged 26 productions and gave 2,585 performances at our home on the South Bank."
Serendipity,Leicester,Leicester,Serendipity.PNG,1,,1,"Serendipity is a diversity-led charity with the specific aim of working in partnership with mainstream organisations to foster quality, culturally diverse work."
Journey to Justice,London,London,JourneytoJustice.jpg,1,1,1,Journey to Justice (JtoJ) aims to inspire and empower people to take action for social justice through learning about human rights movements. We are a voluntary organisation with supporters all over the UK.
Historic England,York,Other,HistoricEngland.PNG,1,1,1,Historic England (formerly known as English Heritage) forms the strategic and regulatory non-departmental public body that advises Government on the protection and enjoyment of the historic environment in England.
Birmingham Museums Trust,Birmingham,Birmingham,BirminghamMuseumsTrust.jpg,1,,,Birmingham Museums Trust has extraordinary venues that provide a fascinating glimpse into Birmingham's rich and vibrant past and showcase world class museum collections.
Boots Archives,Nottingham,Nottingham,Boots.JPG,1,1,1,"Boots Archives was established in the mid-1990s to develop, extend and promote the heritage collection of Boots UK."
British Film Institute,London,London,BritishFilmInstitute.jpg,1,,,"Founded in 1933, the BFI combines cultural, creative and industrial roles, bringing together the BFI National Archive and BFI Reuben Library, film distribution, exhibition and education at BFI Southbank and BFI IMAX."
Broadway Media Centre,Nottingham,Nottingham,BroadwayMediaCentre.jpg,1,1,,"Broadway Media Centre is an independent cinema showcasing the best international films, host of Nottingham’s finest digital art and home to the chilled out Mezz Bar."
National Army Museum,London,London,NationalArmyMuseum.jpg,1,,1,"The National Army Museum vision is to be the leading authority on the history of the British Army and a first class museum that moves, inspires, challenges, educates and entertains."
Creative Leicestershire,Leicester,Leicester,CreativeLeicestershire.jpg,1,,1,"Creative Leicestershire supports small arts, design and media businesses in Leicestershire, Leicester and Rutland."